[
  {
    "id": "hum_001",
    "text": "I could easily forgive his pride, if he had not mortified mine.",
    "label": "human",
    "difficulty": 0.52,
    "topic": "relationships",
    "style_tags": [
      "first_person",
      "literary",
      "concise"
    ],
    "provenance": {
      "type": "human",
      "author": "Jane Austen",
      "work_title": "Pride and Prejudice",
      "publication": "T. Egerton, London",
      "publication_date": "1813",
      "source_url": "https://www.gutenberg.org/ebooks/1342",
      "source_locator": "Chapter 5",
      "citation": "Austen, Jane. Pride and Prejudice. 1813, ch. 5.",
      "license_usage_note": "US-PD",
      "verification_status": "verified",
      "tier": "tier1"
    },
    "language_code": "en",
    "source_language": "en"
  },
  {
    "id": "hum_002",
    "text": "A lady's imagination is very rapid; it jumps from admiration to love, from love to matrimony in a moment.",
    "label": "human",
    "difficulty": 0.58,
    "topic": "relationships",
    "style_tags": [
      "witty",
      "literary",
      "long_sentence"
    ],
    "provenance": {
      "type": "human",
      "author": "Jane Austen",
      "work_title": "Pride and Prejudice",
      "publication": "T. Egerton, London",
      "publication_date": "1813",
      "source_url": "https://www.gutenberg.org/ebooks/1342",
      "source_locator": "Chapter 6",
      "citation": "Austen, Jane. Pride and Prejudice. 1813, ch. 6.",
      "license_usage_note": "US-PD",
      "verification_status": "verified",
      "tier": "tier1"
    },
    "language_code": "en",
    "source_language": "en"
  },
  {
    "id": "hum_003",
    "text": "I am no bird; and no net ensnares me: I am a free human being with an independent will.",
    "label": "human",
    "difficulty": 0.63,
    "topic": "identity",
    "style_tags": [
      "first_person",
      "assertive",
      "literary"
    ],
    "provenance": {
      "type": "human",
      "author": "Charlotte Bronte",
      "work_title": "Jane Eyre",
      "publication": "Smith, Elder & Co.",
      "publication_date": "1847",
      "source_url": "https://www.gutenberg.org/ebooks/1260",
      "source_locator": "Chapter 23",
      "citation": "Bronte, Charlotte. Jane Eyre. 1847, ch. 23.",
      "license_usage_note": "US-PD",
      "verification_status": "verified",
      "tier": "tier1"
    },
    "language_code": "en",
    "source_language": "en"
  },
  {
    "id": "hum_004",
    "text": "I am too fond of reading books to care to write them.",
    "label": "human",
    "difficulty": 0.47,
    "topic": "creativity",
    "style_tags": [
      "short",
      "humor",
      "first_person"
    ],
    "provenance": {
      "type": "human",
      "author": "Louisa May Alcott",
      "work_title": "Little Women",
      "publication": "Roberts Brothers",
      "publication_date": "1868",
      "source_url": "https://www.gutenberg.org/ebooks/514",
      "source_locator": "Part 1, Chapter 14",
      "citation": "Alcott, Louisa May. Little Women. 1868, pt. 1 ch. 14.",
      "license_usage_note": "US-PD",
      "verification_status": "verified",
      "tier": "tier1"
    },
    "language_code": "en",
    "source_language": "en"
  },
  {
    "id": "hum_005",
    "text": "We are all in the gutter, but some of us are looking at the stars.",
    "label": "human",
    "difficulty": 0.4,
    "topic": "hope",
    "style_tags": [
      "aphorism",
      "imagery",
      "short"
    ],
    "provenance": {
      "type": "human",
      "author": "Oscar Wilde",
      "work_title": "Lady Windermere's Fan",
      "publication": "Elkin Mathews and John Lane",
      "publication_date": "1893",
      "source_url": "https://www.gutenberg.org/ebooks/790",
      "source_locator": "Act 3",
      "citation": "Wilde, Oscar. Lady Windermere's Fan. 1893, act 3.",
      "license_usage_note": "US-PD",
      "verification_status": "verified",
      "tier": "tier1"
    },
    "language_code": "en",
    "source_language": "en"
  },
  {
    "id": "hum_006",
    "text": "The only way to get rid of a temptation is to yield to it.",
    "label": "human",
    "difficulty": 0.49,
    "topic": "morality",
    "style_tags": [
      "aphorism",
      "witty",
      "short"
    ],
    "provenance": {
      "type": "human",
      "author": "Oscar Wilde",
      "work_title": "The Picture of Dorian Gray",
      "publication": "Ward, Lock and Company",
      "publication_date": "1890",
      "source_url": "https://www.gutenberg.org/ebooks/174",
      "source_locator": "Chapter 2",
      "citation": "Wilde, Oscar. The Picture of Dorian Gray. 1890, ch. 2.",
      "license_usage_note": "US-PD",
      "verification_status": "verified",
      "tier": "tier1"
    },
    "language_code": "en",
    "source_language": "en"
  },
  {
    "id": "hum_007",
    "text": "It is not down in any map; true places never are.",
    "label": "human",
    "difficulty": 0.61,
    "topic": "travel",
    "style_tags": [
      "aphorism",
      "concise",
      "philosophical"
    ],
    "provenance": {
      "type": "human",
      "author": "Herman Melville",
      "work_title": "Moby-Dick",
      "publication": "Harper & Brothers",
      "publication_date": "1851",
      "source_url": "https://www.gutenberg.org/ebooks/2701",
      "source_locator": "Chapter 12",
      "citation": "Melville, Herman. Moby-Dick. 1851, ch. 12.",
      "license_usage_note": "US-PD",
      "verification_status": "verified",
      "tier": "tier1"
    },
    "language_code": "en",
    "source_language": "en"
  },
  {
    "id": "hum_008",
    "text": "All this worldly wisdom was once the unamiable heresy of some wise man.",
    "label": "human",
    "difficulty": 0.66,
    "topic": "society",
    "style_tags": [
      "reflective",
      "literary",
      "complex"
    ],
    "provenance": {
      "type": "human",
      "author": "Henry David Thoreau",
      "work_title": "Walden",
      "publication": "Ticknor and Fields",
      "publication_date": "1854",
      "source_url": "https://www.gutenberg.org/ebooks/205",
      "source_locator": "Economy",
      "citation": "Thoreau, Henry David. Walden. 1854, Economy.",
      "license_usage_note": "US-PD",
      "verification_status": "verified",
      "tier": "tier1"
    },
    "language_code": "en",
    "source_language": "en"
  },
  {
    "id": "hum_009",
    "text": "Most men lead lives of quiet desperation and go to the grave with the song still in them.",
    "label": "human",
    "difficulty": 0.57,
    "topic": "life",
    "style_tags": [
      "philosophical",
      "metaphor",
      "long_sentence"
    ],
    "provenance": {
      "type": "human",
      "author": "Henry David Thoreau",
      "work_title": "Walden",
      "publication": "Ticknor and Fields",
      "publication_date": "1854",
      "source_url": "https://www.gutenberg.org/ebooks/205",
      "source_locator": "Economy",
      "citation": "Thoreau, Henry David. Walden. 1854, Economy.",
      "license_usage_note": "US-PD",
      "verification_status": "verified",
      "tier": "tier1"
    },
    "language_code": "en",
    "source_language": "en"
  },
  {
    "id": "hum_010",
    "text": "I would always rather be happy than dignified.",
    "label": "human",
    "difficulty": 0.46,
    "topic": "identity",
    "style_tags": [
      "short",
      "first_person",
      "confessional"
    ],
    "provenance": {
      "type": "human",
      "author": "Charlotte Bronte",
      "work_title": "Jane Eyre",
      "publication": "Smith, Elder & Co.",
      "publication_date": "1847",
      "source_url": "https://www.gutenberg.org/ebooks/1260",
      "source_locator": "Chapter 34",
      "citation": "Bronte, Charlotte. Jane Eyre. 1847, ch. 34.",
      "license_usage_note": "US-PD",
      "verification_status": "verified",
      "tier": "tier1"
    },
    "language_code": "en",
    "source_language": "en"
  },
  {
    "id": "hum_011",
    "text": "The mass of men lead lives of quiet desperation.",
    "label": "human",
    "difficulty": 0.39,
    "topic": "life",
    "style_tags": [
      "short",
      "philosophical",
      "direct"
    ],
    "provenance": {
      "type": "human",
      "author": "Henry David Thoreau",
      "work_title": "Walden",
      "publication": "Ticknor and Fields",
      "publication_date": "1854",
      "source_url": "https://www.gutenberg.org/ebooks/205",
      "source_locator": "Economy",
      "citation": "Thoreau, Henry David. Walden. 1854, Economy.",
      "license_usage_note": "US-PD",
      "verification_status": "verified",
      "tier": "tier1"
    },
    "language_code": "en",
    "source_language": "en"
  },
  {
    "id": "hum_012",
    "text": "I have not failed. I've just found ten thousand ways that won't work.",
    "label": "human",
    "difficulty": 0.43,
    "topic": "work",
    "style_tags": [
      "quote",
      "optimistic",
      "short"
    ],
    "provenance": {
      "type": "human",
      "author": "Thomas A. Edison",
      "work_title": "Interview quotation archive",
      "publication": "Public-domain quotation corpus",
      "publication_date": "1910",
      "source_url": "https://en.wikiquote.org/wiki/Thomas_Edison",
      "source_locator": "Attributed section",
      "citation": "Attributed to Thomas Edison, early 20th century public-domain quote collections.",
      "license_usage_note": "CC-BY-SA",
      "verification_status": "reviewed_secondary_source",
      "tier": "tier2"
    },
    "language_code": "en",
    "source_language": "en"
  },
  {
    "id": "hum_013",
    "text": "A person who never made a mistake never tried anything new.",
    "label": "human",
    "difficulty": 0.44,
    "topic": "learning",
    "style_tags": [
      "quote",
      "short",
      "motivational"
    ],
    "provenance": {
      "type": "human",
      "author": "Albert Einstein",
      "work_title": "Collected quotations",
      "publication": "Public quote archives",
      "publication_date": "1930",